{
  "schemaVersion": 1,
  "name": "Okinawa & Taipei — Fall 2026",
  "startDate": "2026-10-29",
  "endDate": "2026-11-13",
  "timezone": "Asia/Tokyo",
  "stays": [
    {
      "name": "Hotel Palm Royal Resort Kokusai Street",
      "type": "hotel",
      "checkIn": "2026-10-30T15:00",
      "checkOut": "2026-11-02T11:00",
      "location": {
        "name": "Hotel Palm Royal Resort Kokusai Street",
        "address": "3-9-10 Makishi, Naha, Okinawa 900-0013",
        "city": "Naha",
        "lat": 26.2164036,
        "lng": 127.6899187,
        "placeId": "ChIJZRVZ5Xpp5TQR_dEQE5ejr8I",
        "imgRef": "https://lh3.googleusercontent.com/grass-cs/AABkmLcXq2EkF9x8RDeRL2xXA0HqIh8voOx5k7_kyp3V01hBGd8EWc6DOrXnfmqj2ciO2JBcPg1e3LcKJ76Be2Z35xoy4J3Qax-lHKjthsIE4D4nWCSO46VO6hsKyFG31mUjhYQFE8C9jw=s4800-w800"
      },
      "timezone": "Asia/Tokyo",
      "roomType": "Standard Double Room",
      "confirmationNumber": "5641.021.203",
      "notes": "2 adults, 3 nights, no meals. Check-in 3:00 PM – midnight; checkout by 11 AM (leave early Nov 2 for the ferry). ¥68,720. Free cancellation through Oct 26.\n\nJapanese name for taxis: ホテルパームロイヤルリゾート国際通り. +81 98-865-5551. 4-min walk from Makishi monorail station. Ask to store bags before check-in on Oct 30 (a request, not confirmed).\n\nWell positioned for the Nov 1 procession on Kokusai-dori."
    },
    {
      "name": "Tokashiku Marine Village",
      "type": "hotel",
      "checkIn": "2026-11-02T15:00",
      "checkOut": "2026-11-03T11:00",
      "location": {
        "name": "Tokashiku Marine Village",
        "city": "Tokashiki Island",
        "lat": 26.185769,
        "lng": 127.3478751,
        "placeId": "ChIJue1QZphT5TQRXIN9P36M-Iw",
        "imgRef": "https://lh3.googleusercontent.com/place-photos/AG9NLjC-8AWk6y19Ls7rrGBJ0dn9QRbGndT3ZeMwplndDX1koPKMPQMK2Fw59BArrEiOjAf41GDf2aQqau79IaGxPetXWx4ug7XZ42Lg_WjjOyJ7VBfE7w6Dy9-JnKmhwjcWDg2bq8yR-pxC9GObKeplwH-_SQ=s4800-w800"
      },
      "timezone": "Asia/Tokyo",
      "roomType": "Japanese-Style Triple Room with Sea View (3 futons)",
      "confirmationNumber": "5547.500.982",
      "notes": "2 adults, 3 futons. Check-in 3:00 – 6:00 PM; checkout by 11 AM. Breakfast and dinner included (breakfast 7–9 AM, dinner 6–8:30 PM). ¥36,766. Free cancellation through Oct 29.\n\nShuttle to/from Tokashiki Port (~10 min). **Before travel, call +81 98-987-2426** with the Nov 2 9:40 AM arrival and Nov 3 5:00 PM ferry; confirm return shuttle time, luggage storage and post-checkout showers. Ask about snorkel operators."
    },
    {
      "name": "Ryukyu Hotel & Resort Nashiro Beach",
      "type": "hotel",
      "checkIn": "2026-11-03T15:00",
      "checkOut": "2026-11-05T11:00",
      "location": {
        "name": "Ryukyu Hotel & Resort Nashiro Beach",
        "city": "Itoman",
        "lat": 26.0998319,
        "lng": 127.6597016,
        "placeId": "ChIJcbc7agtn5TQRA1kniXw8cXs",
        "imgRef": "https://lh3.googleusercontent.com/grass-cs/ACvplmNdixEuBRkxOQfKyxFaVu9VklcStJUV3SCOv00Y8zLjjojyYP1dgZzEi3U4MDUwVqIbMd3EaJSdc1L7iRzbUOoJ32eqRImis6ePo9lv1TdFof1hDaDzPxGH9mbyp83MMg4ebMhLTg=s4800-w800"
      },
      "timezone": "Asia/Tokyo",
      "roomType": "Deluxe Twin Room",
      "notes": "2 adults. Breakfast included. Wedding stay — **wedding day is Nov 4**. Arriving in the evening Nov 3 by taxi from Tomari Port; tell the hotel."
    },
    {
      "name": "Anse Yomitan Toya",
      "type": "hotel",
      "checkIn": "2026-11-05T15:00",
      "checkOut": "2026-11-06T11:00",
      "location": {
        "name": "Anse Yomitan Toya",
        "address": "20 Toya, Yomitan, Nakagami District, Okinawa 904-0305, Japan",
        "city": "Yomitan",
        "lat": 26.3916097,
        "lng": 127.7232628,
        "placeId": "ChIJsTpNL6QX5TQRTe2b93k_t54",
        "imgRef": "https://lh3.googleusercontent.com/grass-cs/AABkmLcx07HpnRbNvGL9EwhjI91z7ELQTIpA7l4H9ut9h9GQOKAfAJmJNjE0ELQaNOkPkkg5nwP1wkRJwGBxoj422ssNk2zX_GtQoeRTyhEsmTnpnS8v0z7RL-kfwg0rdSPpkpC-iwA4XydMibg=s4800-w800"
      },
      "timezone": "Asia/Tokyo",
      "roomType": "Ocean King Room with Jacuzzi Bath",
      "confirmationNumber": "5321.148.594",
      "notes": "Sea view. Check-in 3:00 – 11:30 PM; checkout Nov 6 by 11 AM. No meals. Free parking."
    },
    {
      "name": "The Lodge Okinawa",
      "type": "hotel",
      "checkIn": "2026-11-06T15:00",
      "checkOut": "2026-11-08T10:00",
      "location": {
        "name": "The Lodge Okinawa",
        "address": "1563 Imadomari, Nakijin, Okinawa",
        "city": "Nakijin",
        "lat": 26.6907903,
        "lng": 127.9242358,
        "placeId": "ChIJt05CXAD55DQRtWv9Jkvt6vA",
        "imgRef": "https://lh3.googleusercontent.com/grass-cs/AABkmLcxG2wQonTLT0iqu8b3Q6jINyChkuSzd93U3E4w_6xXCrJvVH3A6pe601u63NuAdx8GwX1Muqi5DiM_ImfS7QpRQ1UAVmYI3Jvb1shFCGr0svb1ZmY1-ExRCdkKpsL_ROTNAMo=s4800-w800"
      },
      "timezone": "Asia/Tokyo",
      "roomType": "Tent / glamping-style unit, queen bed, sauna",
      "confirmationNumber": "5802.023.707",
      "notes": "2 nights. Check-in 3:00 – 7:00 PM; checkout Nov 8 by 10 AM. No meals. Free parking. Shared bathroom/toilet. ¥55,440 total. Free cancellation through Oct 22, 11:59 PM JST (¥27,720 from Oct 23).\n\n**¥15,000 refundable damage deposit by card at arrival** — ask how it's refunded. +81 980-43-1300. Tell them ~4:30 PM arrival."
    },
    {
      "name": "Hotel Nikko Taipei",
      "type": "hotel",
      "checkIn": "2026-11-09T15:00",
      "checkOut": "2026-11-12T11:00",
      "location": {
        "name": "Hotel Royal-Nikko Taipei",
        "address": "No. 37-1, Section 2, Chung Shan North Road, Zhongshan District, Taipei City 104, Taiwan",
        "city": "Taipei",
        "lat": 25.0536679,
        "lng": 121.5229126,
        "placeId": "ChIJH5UrwGipQjQR5s5WfFvR-44",
        "imgRef": "https://lh3.googleusercontent.com/place-photos/AG9NLjDit-kB2ixBpPXF4XVtkIQHoaL3VD3_t72piUKU5Cf-VSyLkuIhahTK0prATsespBgMVGQH1uiGOPm-XjExTArReBLNVm6WD76HhI_tT9d2s7tS0o3FNJm4WAN6um9tDeoWjTQBRmMY66CyOaw=s4800-w800"
      },
      "timezone": "Asia/Taipei",
      "roomType": "Premier Double Room, 1 queen bed",
      "confirmationNumber": "6158.360.312",
      "notes": "Booked via Booking.com (listed as Hotel Royal-Nikko Taipei). 2 adults, no breakfast. Booking PIN 9273. TWD 22,585 total, prepaid in full at any time.\n\nFree cancellation through Nov 5, 2026, 11:59 PM Taipei time; after that, no changes and the full amount is forfeited.\n\nPool is closed for seasonal maintenance during the stay. Bring toiletries, photo ID and the card used to book for check-in. About a 3-minute walk from Zhongshan MRT Exit 3."
    },
    {
      "name": "JR Kyushu Hotel Blossom Naha",
      "type": "hotel",
      "checkIn": "2026-11-12T15:00",
      "checkOut": "2026-11-13T11:00",
      "location": {
        "name": "JR Kyushu Hotel Blossom Naha",
        "address": "2-16-1 Makishi, Naha, Okinawa",
        "city": "Naha",
        "lat": 26.2173462,
        "lng": 127.6878124,
        "placeId": "ChIJG66LQHtp5TQRIiNK6_jKMmo",
        "imgRef": "https://lh3.googleusercontent.com/grass-cs/AABkmLfUmCgzyP7p35qO3uvTT8P8zOGlLhsCqUlpM6WZt3He4-O3i_3OJ3kEtCcasAXI50ApWrFty8cmfUOhrVDQjUWFH2CcERPJz_qoD2LRG2KrCu74TwGr-romFPUmOP1KFPgKftw=s4800-w800"
      },
      "timezone": "Asia/Tokyo",
      "roomType": "Superior Double Room",
      "confirmationNumber": "5547.504.097",
      "notes": "Check-in 3:00 – 11:00 PM; checkout Nov 13 5:00 – 11:00 AM. Breakfast included.\n\nArriving ~10–10:30 PM off IT232 — tell the hotel and confirm late-arrival procedure. JR九州ホテル ブラッサム那覇. 5-min walk from Miebashi monorail station."
    }
  ],
  "travels": [
    {
      "title": "Chicago → Taipei",
      "mode": "flight",
      "carrier": "EVA Air",
      "number": "BR55",
      "from": {
        "name": "Chicago O'Hare International Airport (ORD), Terminal 5",
        "city": "Chicago",
        "lat": 41.9799743,
        "lng": -87.909816,
        "placeId": "ChIJvQg4-9O1D4gROS6m-S6-5LA",
        "imgRef": "https://lh3.googleusercontent.com/place-photos/AG9NLjBbnQtgtmNC-M4i5O7sI9qFeyRGm0d07PqTgDqq3WXsgoAi0zgDzitr0Jo9jp6srwU575C3ycQMXKE3iLOYCe7CT7LbNSVZ5y87N9DmyoUTj7jVbT0yzTa46UYTEFi7012h0u5XaoXfUMImBF2gMBdwMA=s4800-w800"
      },
      "to": {
        "name": "Taiwan Taoyuan International Airport (TPE), Terminal 2",
        "city": "Taipei",
        "lat": 25.0793174,
        "lng": 121.2345977,
        "placeId": "ChIJ1RXSYsCfQjQRCbG1qZC2o3A",
        "imgRef": "https://lh3.googleusercontent.com/place-photos/AG9NLjAFFmI2uFzUPqG_kV0ZE0Maolo0FXi8tYWqScJ1Yf5qd3WmlEriW5ZR4fp4uLsp-iLpY_x4nH-FXYJxMjGQIiCT6Zq60j0Y3u78QdWVY0yqj29DgGigGsWOFu_cPHhcCFns-D2qte-ECk6K2KJKg5Vndg=s4800-w800"
      },
      "depart": "2026-10-29T00:30",
      "departTimezone": "America/Chicago",
      "arrive": "2026-10-30T05:25",
      "arriveTimezone": "Asia/Taipei",
      "confirmationNumber": "DAAL7X",
      "notes": "Our big send-off. The flight leaves at 12:30 AM, so we head to O'Hare the evening of **Oct 28** and aim to be there around 9:30 PM. EVA Air flies from Terminal 5 (international). At the counter, ask them to check our bags all the way to Naha and print the BR112 boarding pass too, so Taipei is just a quick walk between gates.\n\nTicket 695 2464270937 · 2 checked bags."
    },
    {
      "title": "Taipei → Naha",
      "mode": "flight",
      "carrier": "EVA Air",
      "number": "BR112",
      "from": {
        "name": "Taiwan Taoyuan International Airport (TPE), Terminal 2",
        "city": "Taipei",
        "lat": 25.0793174,
        "lng": 121.2345977,
        "placeId": "ChIJ1RXSYsCfQjQRCbG1qZC2o3A",
        "imgRef": "https://lh3.googleusercontent.com/place-photos/AG9NLjAFFmI2uFzUPqG_kV0ZE0Maolo0FXi8tYWqScJ1Yf5qd3WmlEriW5ZR4fp4uLsp-iLpY_x4nH-FXYJxMjGQIiCT6Zq60j0Y3u78QdWVY0yqj29DgGigGsWOFu_cPHhcCFns-D2qte-ECk6K2KJKg5Vndg=s4800-w800"
      },
      "to": {
        "name": "Naha Airport (OKA), Terminal 1",
        "city": "Naha",
        "lat": 26.1966997,
        "lng": 127.6489521,